{
  "$schema": "schema/capabilities.schema.json",
  "as_of": "2026-09-22",
  "entries": [
    {
      "vendor": "Google",
      "model": "Veo 3.1 / 3.1 Fast / 3.1 Lite（Gemini API）",
      "source_url": "https://ai.google.dev/gemini-api/docs/veo",
      "first_last_frame": "支持【官方源】image（首帧）+ lastFrame（尾帧）参数，二者需组合使用，Veo 3.1 系列独有",
      "extend": "支持【官方源】Veo 3.1/Fast：传 video 参数延长 +7s/次，最多 20 次；输入须为 Veo 生成且 ≤141s，总长 ≤148s；仅 720p",
      "reference": "参考图最多 3 张【官方源】referenceImages（type=asset），仅 Veo 3.1；参考生视频时不支持分辨率/时长/纵横比参数",
      "audio_joint": "原生音画同生，始终开启，无关闭开关【官方源】",
      "resolution": "720p（默认）/1080p/4k（4k 仅 8s）；Lite 仅 720p/1080p；延长仅 720p【官方源】",
      "duration": "4/6/8s，24fps；用延长/参考图/1080p/4k 时强制 8s【官方源】",
      "region_limits": "personGeneration 在欧盟/英国/瑞士/中东受限为 allow_adult【官方源】；SynthID 水印；无中国大陆端点",
      "webhook": "无【官方源】异步 predictLongRunning + 轮询 operation（建议 10s 间隔）",
      "url_validity": "服务端保留 2 天，下载需自存；延长操作会重置计时【官方源】",
      "billing_mode": "页面未含价格【官方源-缺口】；按请求生成 1 个视频，prompt 上限 1024 token"
    },
    {
      "vendor": "快手 可灵 Kling",
      "model": "kling-v3 / kling-v3-omni（另有 3.0-turbo、video-o1、v2-6、v2-5-turbo）",
      "source_url": "https://kling.ai/document-api/guides/capability-map/video",
      "first_last_frame": "支持【官方源】contents[] 中 type=first_frame/last_frame；首帧必填尾帧可选；不支持仅尾帧（End Frame Only 全系否）",
      "extend": "能力图中未见独立视频延长 API【官方源-缺口】",
      "reference": "Element 元素引用最多 3 个（element_id）【官方源】；Omni/O1 支持 Video Reference 视频输入与多模态指令",
      "audio_joint": "支持【官方源】settings.audio=native|off（默认 off）；V3 系/O1/2.6 具备 Native Audio；3.0 Omni 支持人声 Voice Control；2.5 Turbo 无",
      "resolution": "720p/1080p 全系；4K 仅 kling-v3 与 kling-v3-omni【官方源】",
      "duration": "V3 系 3~15s；O1/2.6 3~10s；2.5 Turbo 5/10s；多镜头 shot 1-6（每镜 ≥1s，总和=总时长）【官方源】",
      "region_limits": "全球站文档示例 base=https://api-singapore.klingai.com【官方源】；CN 端点（api-beijing）未在当前页面确认",
      "webhook": "支持【官方源】options.callback_url + external_task_id，另有 Callback Protocol 规范页；任务轮询 GET /tasks（submitted/processing/succeeded/failed）",
      "url_validity": "产物 URL 30 天后清除，需及时转存【官方源】（响应字段注释原文）",
      "billing_mode": "按秒 Unit 计费【官方源】720p：3.0 Turbo 0.8U($0.112)/s；V3 0.6~0.8U/s、4K 3.0U/s；Omni 含视频输入 0.9~1.2U/s；2.5 Turbo 0.3U/s；口型 0.07$/5s"
    },
    {
      "vendor": "字节跳动 Seedance（火山方舟 Ark）",
      "model": "doubao-seedance-2-5（2.5 已全面公开）/ doubao-seedance-2-0 / 2.0 mini / 2.0 fast",
      "source_url": "https://docs.volcengine.com/docs/82379/1520757",
      "first_last_frame": "支持【官方源】content[] 示例含「有声视频-首帧」「有声视频-首尾帧」；return_last_frame 参数可返回尾帧",
      "extend": "支持【官方源】官方示例列表含「延长视频」",
      "reference": "多参考【官方源】content[] 中 image_url(role=reference_image)、video_url(role=reference_video)，示例同传 1 图 + 6 视频；omni_reference_task_type=auto/reference/edit 引导任务类型",
      "audio_joint": "支持【官方源】generate_audio 默认 true（有声视频），可关闭",
      "resolution": "resolution 参数（示例含 480p/720p/1080p 档位，定价按 480p/720p/1080p 分档）【官方源】；ratio 宽高比、frames 帧数参数",
      "duration": "duration integer（示例 15s）【官方源】",
      "region_limits": "CN base=https://ark.cn-beijing.volces.com/api/v3【官方源】；海外 BytePlus 端点未在本页确认",
      "webhook": "支持【官方源】callback_url 参数；另有 execution_expires_after（默认 172800s=48h 任务超时）、priority、service_tier；轮询 GET tasks（running/succeeded/failed，示例 10s 间隔）",
      "url_validity": "未在本页说明【官方源-缺口】",
      "billing_mode": "按秒按分辨率计费【官方源】2.0 mini 720p 刊例价约 0.2 元/s（4 折活动价）、2.0 fast 约 0.6 元/s（75 折），活动期 2026-08-07~10-07 仅企业用户；亦提及按 token 结算口径"
    },
    {
      "vendor": "阿里云 百炼 通义万相",
      "model": "wan2.7-t2v / wan2.7-i2v / wan2.7-r2v（快照版 wan2.7-*-2026-04-25）",
      "source_url": "https://help.aliyun.com/zh/model-studio/video-generation",
      "first_last_frame": "支持【官方源】wan2.7-i2v 支持首帧、首尾帧、视频续写及续写+尾帧控制；另有 kf2v 专线（wan2.2-kf2v-flash、wanx2.1-kf2v-plus）",
      "extend": "视频续写（含尾帧控制）【官方源】wan2.7-i2v",
      "reference": "参考生视频【官方源】wan2.7-r2v 多主体参考、支持为主体配置音色（[2s,10s]）；wan2.6-r2v/-flash",
      "audio_joint": "支持【官方源】wan2.7-t2v「有声视频、多镜头叙事、声画同步」，文本+音频输入；wan2.5 同为声画同步；wan2.2 及 wanx2.1 为无声",
      "resolution": "wan2.7：720P/1080P，30fps MP4(H.264)【官方源】；wan2.5 480P/720P/1080P；wan2.2 480P/1080P",
      "duration": "wan2.7/2.6：[2s,15s] 整数（全球站 2.6 为 5/10/15s）【官方源】；wan2.5 5/10s；wan2.2 多为 5s",
      "region_limits": "多地域【官方源】北京（wan2.7/2.6/2.5/2.2/2.1 全系）、新加坡（wan2.7 起全系）、美国（wan2.6-t2v-us）",
      "webhook": "异步任务+轮询（DashScope video_synthesis，页面未展开参数）【官方源-缺口】",
      "url_validity": "未在概览页说明【官方源-缺口】",
      "billing_mode": "未在概览页说明【官方源-缺口】；水印：API watermark 参数默认 false"
    },
    {
      "vendor": "腾讯 混元/TokenHub",
      "model": "TokenHub 统一平台（混元自研 + 第三方代售）；混元生视频（旧平台）",
      "source_url": "https://cloud.tencent.com/document/product/1823",
      "first_last_frame": "未在已核实页面说明【官方源-缺口】",
      "extend": "未在已核实页面说明【官方源-缺口】",
      "reference": "【官方源】TokenHub 代售 Kling-Video-V3（智能分镜 15s、最高 4K Ultra）、MiniMax-Video-H3（文字/图片/音频/视频多模态输入输出）、Vidu-Video-q3.0-pro（540P/720P/1080P）",
      "audio_joint": "未在已核实页面说明；旧混元生视频平台有人像驱动（图片+音频+文本、口型匹配）与图片唱演【官方源】",
      "resolution": "代售模型：Kling 最高 4K、Vidu q3.0-pro 540P/720P/1080P【官方源】",
      "duration": "Kling-Video-V3 15s 长视频【官方源】",
      "region_limits": "无中国大陆限制问题（腾讯云国内平台）【官方源】",
      "webhook": "未在已核实页面说明【官方源-缺口】",
      "url_validity": "未在已核实页面说明【官方源-缺口】",
      "billing_mode": "视频生成 10 元/百万 tokens、按秒折算（Kling 720P 约 0.6 元/s）；文本按百万 tokens 阶梯；Token Plan 套餐比按量便宜 50%-80%【官方源】；旧混元平台已停止新增模型，逐步迁移至 TokenHub（/document/product/1616/106105）"
    },
    {
      "vendor": "生数科技 Vidu",
      "model": "viduq1 / viduq1-pro / vidu2 / vidu2.5（ Vidu-Video-q3.0-pro 见 TokenHub）",
      "source_url": "https://platform.vidu.cn",
      "first_last_frame": "支持【官方源】官方开放平台列出「首尾帧生视频（start-end-to-video）」；Zhipu 代售参数：viduq1-start-end/vidu2-start-end，image_url 数组 1-2 张、首尾帧分辨率比例须 0.8-1.25",
      "extend": "支持【官方源】官方文档列出「视频延长（video-extend）」",
      "reference": "支持【官方源】「参考生视频（reference-to-video）」；Zhipu 代售 vidu2-reference 支持 1-3 张参考图",
      "audio_joint": "未在已核实官方页面说明（Zhipu 代售 Vidu 模型的 with_audio 注释为添加背景音乐）【单一来源-第三方平台】",
      "resolution": "Zhipu 代售：viduq1 仅 1920x1080、vidu2 1280x720（start-end 另有 480x360）【官方源-智谱文档】；TokenHub 上 q3.0-pro 540P/720P/1080P【官方源】",
      "duration": "Zhipu 代售：viduq1 5s、vidu2 4s【官方源-智谱文档】",
      "region_limits": "国内开放平台 platform.vidu.cn，base https://api.vidu.cn【官方源】；海外 vidu.com 未核实",
      "webhook": "未核实【缺口】",
      "url_validity": "未核实【缺口】",
      "billing_mode": "官网有「定价」入口，数值未核实【缺口】"
    },
    {
      "vendor": "MiniMax 海螺",
      "model": "Hailuo（第三方平台代售名：MiniMax-Video-H3、hailuo-2.3 / 2.3-fast）",
      "source_url": "https://platform.minimaxi.com/document/video_generation",
      "first_last_frame": "未核实【缺口】官方文档正文需登录（本次会话 Playwright/web_reader 均只能取到标题）",
      "extend": "未核实【缺口】",
      "reference": "【官方源-代售描述】TokenHub：MiniMax-Video-H3 支持文字/图片/音频/视频多种输入输出；Pika 平台列出 h3 有 reference-to-video 能力【单一来源-第三方】",
      "audio_joint": "【官方源-代售描述】TokenHub 描述 H3 多模态输入输出（含音频）；未获 MiniMax 自有文档确认",
      "resolution": "未核实【缺口】",
      "duration": "未核实【缺口】",
      "region_limits": "国内平台 platform.minimaxi.com；国际站 www.minimax.io/platform（本次访问被反爬中断）",
      "webhook": "未核实【缺口】",
      "url_validity": "未核实【缺口】",
      "billing_mode": "未核实【缺口】（官方文档在登录墙后）"
    },
    {
      "vendor": "爱诗科技 PixVerse",
      "model": "PixVerse API（模型版本清单见官方「模型列表」页，本次未取到正文）",
      "source_url": "https://apidoc.pixverse.ai/",
      "first_last_frame": "支持【官方源-目录层】官方文档目录含「首尾帧生视频」章节；参数未核实",
      "extend": "支持【官方源-目录层】官方文档目录含「视频延长」章节；参数未核实",
      "reference": "未核实【缺口】（目录含「特效视频」）",
      "audio_joint": "未核实【缺口】",
      "resolution": "未核实【缺口】",
      "duration": "未核实【缺口】",
      "region_limits": "未核实【缺口】",
      "webhook": "未核实【缺口】",
      "url_validity": "未核实【缺口】",
      "billing_mode": "【官方源-目录层】目录含「信用点说明」章节，说明为 credits/信用点体系；单价未核实"
    },
    {
      "vendor": "Runway",
      "model": "gen4.5 / aleph2 / act_two + 代售 wan3、seedance2/2_5、hailuo3、veo3.1、grok_imagine_1_5 等",
      "source_url": "https://docs.dev.runwayml.com/guides/models/",
      "first_last_frame": "代售 seedance2 支持 first/last-frame 锚定（目录页描述）【官方源】；gen4_turbo 仅图像输入",
      "extend": "未在已核实页面确认独立延长 API【官方源-缺口】",
      "reference": "代售 hailuo3 +2cr/参考图、grok_imagine_1_5 +1cr/参考图【官方源-定价页】；aleph2 为 v2v",
      "audio_joint": "代售 veo3.1 分 with-audio 40cr/s / no-audio 20cr/s 两档计费，说明其支持原生音频【官方源】",
      "resolution": "代售分档：wan3 480p/720p/1080p；seedance2 480/720p=36cr、1080p=40cr、4K=150cr/s；hailuo3 768P/2K【官方源】",
      "duration": "按秒计费（价格表单位 $/s credit），具体秒数档未在已核实页列出【官方源-缺口】",
      "region_limits": "base https://api.dev.runwayml.com，头 X-Runway-Version: 2024-11-06【官方源】；无 CN 端点",
      "webhook": "无 webhook 文档【官方源】POST text_to_video/image_to_video/video_to_video → 轮询 GET /v1/tasks/{id}（PENDING/THROTTLED/RUNNING/SUCCEEDED/FAILED/CANCELLED），DELETE 可取消",
      "url_validity": "产物 URL 约 24-48 小时内过期，官方建议立即下载并自托管【官方源 outputs 文档】",
      "billing_mode": "credit 制 $0.01/credit、按秒计费【官方源】gen4.5=12、gen4_turbo=5、aleph2=28、act_two=5 cr/s；Pro/HDR 附加费 5-40cr/s 仅限 Gen-4.5/Aleph 2"
    },
    {
      "vendor": "Luma",
      "model": "ray-2 / ray-flash-2（Dream Machine API 旧版文档；新版 Agents API 与 Ray3 系在 docs.agents.lumalabs.ai，本次不可达）",
      "source_url": "https://docs.lumalabs.ai/docs/video-generation",
      "first_last_frame": "支持【官方源】keyframes.frame0（首帧）/ frame1（尾帧），值可为 {type:image,url} 或 {type:generation,id}；支持仅首帧、仅尾帧、首+尾组合",
      "extend": "支持【官方源】以已完成的 generation 作为 frame0=正向延长、作为 frame1=反向延长、两者=插值；另有 loop 参数",
      "reference": "未发现独立多参考图机制【官方源-缺口】",
      "audio_joint": "未发现音画同生能力【官方源-缺口】（旧版 ray-2 无音频）",
      "resolution": "540p/720p/1080p/4k【官方源】",
      "duration": "示例 5s【官方源】；9s 档未在已核实页出现",
      "region_limits": "无 CN 端点【官方源】",
      "webhook": "支持【官方源】callback_url：POST Generation 对象（含 status/video url/failure reason 全部更新），失败重试 3 次@100ms，超时 5s",
      "url_validity": "未在已核实页面说明【官方源-缺口】",
      "billing_mode": "API 余额以美分计（GET /dream-machine/v1/credits 返回 credit_balance 单位 cents USD）【官方源】；先预扣、失败全额退款；消费级订阅 Plus$30/Pro$90/Ultra$300/月 含 1/4/15 万积分，积分按月过期【官方源-定价页】；官网 App 已代售 Veo 3.1、Kling 3.0/Omni、Seedance 2.0"
    },
    {
      "vendor": "Pika",